text,topic,blog_name,pet,word_count,chunk_size
"environment chinchillas are social and friendly animals and like to be around you. ideally, you should house your chinchilla in an area where you spend a lot of time, like your living room or bedroom. avoid placing their enclosure in direct sunlight or a drafty area. the optimal temperature is between 55-70 f, and should never reach higher than 80 f. humidity should be below 40-50%.",Environment,Chinchilla Care Sheet,Chinchillas,66,77
"pet parents chinchilla pet parents should be able and willing to provide the proper housing, diet, daily exercise, and routine veterinary care. as social animals that require daily care, chinchillas are not ideal for people who travel often and are frequently away from home. if children are the main caregiver, a parent should be actively involved with the chinchilla’s care. keep in mind that chinchillas are more active at night. /24, ",Pet parents,Chinchilla Care Sheet,Chinchillas,71,82
"other pets in the household chinchillas can be housed in pairs of the same sex or opposite sex. they should not be housed with other animals, and they especially should not be housed near rabbits. family friendliness level chinchillas enjoy daily interactions with their family. this provides both exercise and helps your chinchilla bond with you. if your chinchilla is barking or showing aggression, do not try and handle them.",Other Pets in the Household Family Friendliness Level,Chinchilla Care Sheet,Chinchillas,70,77
chinchilla habitat,Chinchilla Habitat,Chinchilla Care Sheet,Chinchillas,2,2
"enclosure a single chinchillas requires a minimum enclosure of 2 feet by 2 feet by 4 feet. the ideal habitat has wire sides no more than 1 inch apart with a flat bottom such as a plastic tray to prevent pressure sores on their feet. the habitat should have multiple tiers, ramps, and shelves for climbing and playing.",Enclosure,Chinchilla Care Sheet,Chinchillas,58,63
"bedding provide 1-2 inches of high-quality paper bedding or crumbled paper. wood shavings should not be used because they can be ingested and may cause an intestinal blockage (chinchillas cannot vomit). cedar shavings may cause skin and respiratory tract inflammation, so they should also not be used. newspaper is another good alternative for bedding.",Bedding,Chinchilla Care Sheet,Chinchillas,54,62
feeding dishes chinchilla pellets can be provided in a ceramic or stainless steel dish. free-choice hay can be provided throughout the enclosure or in a hay trough.,Feeding dishes,Chinchilla Care Sheet,Chinchillas,27,30
"other it is important to provide hide boxes for your chinchilla made out of edible material like hay. wooden chinchilla safe blocks are also very important because their teeth continuously grow—this helps wear them down naturally. chinchilla diet chinchillas are herbivores and require an unlimited, continuous supply of high-quality hay such as timothy, oat meadow orchard, or any other low calcium hay. alfalfa should only be provided to young chinchillas or nursing mothers because the high /24, calcium can cause bladder stones. in addition to the hay, provide 1 tablespoon per day of chinchilla pellets in a bowl and small amounts of fresh vegetables. too many pellets can lead to obesity and diarrhea.",Other Chinchilla Diet,Chinchilla Care Sheet,Chinchillas,113,126
water your chinchilla requires unlimited fresh clean water every day from a bowl or bottle.,Water,Chinchilla Care Sheet,Chinchillas,15,16
"treats some chinchilla-friendly treats including low-calcium vegetables such as carrot tops, green peppers, and leafy greens. small amounts of fruit such as apples can be offered occasionally, like once a week. you can also offer high-fiber treats like apple wood sticks. treats should be no more than 1-10% of the diet.",Treats,Chinchilla Care Sheet,Chinchillas,51,63
supplements chinchillas do not require vitamins or supplements unless otherwise directed by your veterinarian.,Supplements,Chinchilla Care Sheet,Chinchillas,14,15
"foods to avoid chinchillas should not be fed chocolate, caffeine, or alcohol. these are toxic to chinchillas. seeds nuts and dried fruit should also not be offered because they are high in sugar and fat.",Foods to Avoid,Chinchilla Care Sheet,Chinchillas,35,40
daily care for chinchillas,Daily Care for Chinchillas,Chinchilla Care Sheet,Chinchillas,4,4
"feeding you can offer 1-2 tablespoons of chinchilla pellets per day, preferably in the morning or evening. any fruits or veggies not eaten should be discarded within 1-2 hours to prevent spoiling. water and hay should be offered at all times in an unlimited supply. grooming chinchillas require dust baths at least a few times a week. they also should be brushed with a soft-bristled brush in the direction of their fur. do not bathe your chinchilla or get them wet because their fur takes a while to dry and the skin can become inflamed. since chinchilla teeth grow continuously, it is important to provide them with chinchilla-safe chew toys such as wooden sticks or blocks for them to wear down their teeth appropriately. chinchilla-safe dust like oxbow poof! is very important for your chinchilla’s coat health to keep it clean and oil-free. p lace a dust bath in their enclosure daily for at least 30 minutes, or you can leave it in the enclosure. if you leave it in, clean the dust /24, bath every day and completely replace after one week. a dust box should be about 6 inches x 6 inches x 9 inches with 1-2 inches of dust.",Feeding Grooming,Chinchilla Care Sheet,Chinchillas,202,227
"exercise chinchillas should get daily exercise in their enclosure and outside of their enclosure. flat 15-inch exercise wheels are a great way for them to exercise inside their habitat, which should also include lots of ramps and levels for them to run around and climb on.",Exercise,Chinchilla Care Sheet,Chinchillas,46,50
"disinfecting/cleaning cages should be emptied and cleaned at least weekly with soap and water. bedding should be replaced weekly. food bowls and water bowls should be cleaned daily with soap and water. the cage should be spot cleaned once a day to remove and feces, wet/soiled bedding, and leftover food. enrichment in addition to dust baths, provide your chinchilla with pet-safe wooden chew toys, pvc pipes for climbing, cardboard boxes, and flat 15-inch exercise wheels.",Disinfecting/cleaning Enrichment,Chinchilla Care Sheet,Chinchillas,75,90
veterinary care for chinchillas,Veterinary Care for Chinchillas,Chinchilla Care Sheet,Chinchillas,4,4
"annual care chinchillas require annual checkups with your primary veterinarian to make sure they are healthy and thriving in your care. in addition to a physical exam and dental exam, bloodwork and dental work may be performed at these appointments. signs of a healthy pet signs of a healthy chinchilla include: eating and drinking well healthy fur bright eyes walking and climbing without limping breathing comfortably without nasal discharge acting active and playful /24, ",Annual Care Signs of a Healthy Pet,Chinchilla Care Sheet,Chinchillas,74,79
"when to call the vet signs that you should schedule an appointment with your veterinarian include: soft/loose poop not eating or drinking well fur loss breathing difficulties lethargy eye or nose discharge drooling limping weight loss overall decreased activity if you have any concerns, it is better to be safe and consult with your veterinarian right away.",When to Call the Vet,Chinchilla Care Sheet,Chinchillas,57,61
common illnesses in chinchillas dental disease barbering fractures fur rings urolithiasis or urinary calculi,Common Illnesses in Chinchillas,Chinchilla Care Sheet,Chinchillas,14,14
"chinchilla faqs is a chinchilla a good pet to have? chinchillas are a wonderful addition to the family, but they have specific needs so it is important to look into owning a chinchilla before you purchase one. are chinchillas rare pets? chinchillas are not rare pets, but they aren’t as common as other pets such as dogs or cats. /24, do chinchillas like to be held? most chinchillas do like to be held, but each chinchilla is different so it’s important to observe your pet and see what they like and dislike. are chinchillas cuddly? chinchillas definitely can be cuddly, but it depends on the individual animal and how it has been socialized. chinchillas are naturally shy animals. are chinchillas good pets for children? chinchillas are not ideal pets for children because they are fragile and require a lot of care, unless a parent is very active in their care daily as well with the child. /24, ",Chinchilla FAQs Is a chinchilla a good pet to have? Are chinchillas rare pets? Do chinchillas like to be held? Are chinchillas cuddly? Are chinchillas good pets for children?,Chinchilla Care Sheet,Chinchillas,157,177
"choking in chinchillas petmd.com /exotic/conditions/respiratory/c_ex_ch_choke what is choking in chinchillas? chinchillas can choke when an object becomes lodged in the esophagus. the resulting bulge in the esophagus can put pressure on the trachea, or windpipe, causing decreased ability to breathe. in some cases, the pressure from the object in the esophagus can close off the windpipe completely, causing inability to breath and eventually suffocation. choking is a life-threatening emergency that can affect a chinchilla at any time.",Choking in Chinchillas What Is Choking in Chinchillas?,Choking in Chinchillas,Chinchillas,77,91
"symptoms of anorexia (refusing to eat) difficulty swallowing lethargy excessive drooling bulging esophagus gagging, retching, or coughing sounds discharge of saliva or food material from the nose anxious behavior pawing at the mouth gasping or open mouth breathing",Symptoms of Choking in Chinchillas,Choking in Chinchillas,Chinchillas,38,41
"causes of the most common cause of choking in a chinchilla happens when they try to swallow something that is too large to pass through the esophagus. this is usually a food item such as nuts, dried fruit, or a coarse pelleted food that expands once chewed. chinchillas can also choke on non-food items they may find. in addition, breeding females will sometimes choke on the placenta they consume after giving birth. chinchillas, like other rodents such as rats and guinea pigs, cannot vomit. their digestive system is only designed for food to go down, not back up. this is largely because the diaphragm that pushes on the stomach to cause vomiting in other animals is not strong enough to do so in chinchillas. /24, improper diet can also lead to a choking episode. since chinchilla teeth continuously grow, they need plenty of hay to chew and grind their molars down. without enough roughage, the molars can overgrow causing an inability to chew food or treats into manageable pieces.",Causes of Choking in Chinchillas,Choking in Chinchillas,Chinchillas,169,189
"how veterinarians diagnose if you suspect your chinchilla is choking, bring him to a veterinarian right away. it is important to keep him calm and minimize stress on the way to the vet, so it's best to place your chinchilla in a small animal carrier for transport. during the physical exam the veterinarian will assess your pet's ability to breathe and feel the throat for a bulge in the esophagus. x-rays may be recommended to see exactly where the object is lodged. sometimes a radio opaque liquid can be administered as well to highlight the path of the digestive tract and look for blockages. your veterinarian may also recommend bloodwork to assess your chinchilla's general health. this can help determine how debilitated he may be and what kind of supportive care and treatment he needs for a successful recovery.",How Veterinarians Diagnose Choking in Chinchillas,Choking in Chinchillas,Chinchillas,139,152
"treatment of once the location of the obstructing object has been determined, your veterinarian will attempt to remove it. anti-spasm medications can be administered to relax the esophageal muscles. flushing the esophagus with water and lubricant may dislodge the blockage, or it can be manually removed with forceps. in some cases, general anesthesia and surgical removal may be necessary. antibiotics and digestive stimulating medications are often prescribed for chinchillas after they have a choking episode. antibiotics will treat pneumonia that may form when food is aspirated into the respiratory tract. gastro-intestinal motility stimulants are often used to restart the regular motion of the digestive system that was stalled during the blockage. if your chinchilla has overgrown teeth that make it difficult for him to chew his food, your veterinarian may recommend a sedated dental procedure to address the issue. overgrown teeth can be trimmed with specialized dental instruments, or they can be ground down with a dremel tool.",Treatment of Choking in Chinchillas,Choking in Chinchillas,Chinchillas,158,174
"recovery and management of a chinchilla recovering from a choking incident needs to rest in a quiet and calm environment. handling should be kept to a minimum (except to feed or give medications) until he is eating well and acting normal again. his bedding should be /24, soft, made of small pieces that won't cause choking if he ingests it, such as carefresh small animal bedding. wood based bedding like pine or cedar shavings should be avoided. as always, make sure plenty of fresh hay is available, and pelleted foods may need to be mashed or softened with water to allow easier swallowing. additional foods or treats should be cut into small pieces to avoid choking again. if your chinchilla is not eating on his own, syringe feeding with a nutritional formula like oxbow critical care may be necessary. in some cases, a nasogastric tube may be placed for liquid feedings and easier administration of medications. monitor your chinchilla closely during his recovery from choking. some chinchillas experience complications after a choking episode such an esophageal rupture or a stalled digestive tract. he should be producing regular stools and cecotropes. if you notice your chinchilla has not eaten or had a bowel movement in a 12-hour period he should be re- evaluated by a veterinarian.",Recovery and Management of Choking in Chinchillas,Choking in Chinchillas,Chinchillas,215,238
" faqs is choke in chinchillas an emergency? a blockage in the esophagus that causes a chinchilla to choke will often put pressure on the trachea, or windpipe. choking in chinchillas is always an emergency situation because there is potential for the airway to become obstructed, what do i do if my chinchilla is choking? if your chinchilla is showing signs of choking, keep him calm and quiet and bring him to a veterinarian right away. can i prevent choke in chinchillas? choking can be prevented by feeding a proper diet with lots of hay, limited pellets, and very small pieces of food or treats. always supervise your chinchilla when he is out of his cage to ensure he doesn't chew on inappropriate objects. written by catherine gose, cvt veterinarian technician /24, /24, ",Choking in Chinchillas FAQs Is choke in chinchillas an emergency? What do I do if my chinchilla is choking? Can I prevent choke in chinchillas?,Choking in Chinchillas,Chinchillas,132,148
"difficulty giving birth in chinchillas petmd.com /exotic/conditions/reproductive/c_ex_ch_dystocia dystocia in chinchillas when a chinchilla has difficulty giving birth or there is a birthing abnormality, the condition is called dystocia. though this condition is rarely encountered in chinchillas, dystocia can occur in very young females when they are bred early before the uterus and pelvic bones have fully developed. dystocia may also occur when the fetus is abnormally large or in misplaced fetuses. when dystocia is suspected, a veterinarian should be asked to tend to the case to prevent any complications from developing. the veterinarian will use hormonal aids like oxytocin to help the chinchilla deliver the kit in an easier manner. if the chinchilla still faces difficulty giving birth, surgical delivery in the way of c-section may be done.",Difficulty Giving Birth in Chinchillas Dystocia in Chinchillas,Difficulty Giving Birth in Chinchillas,Chinchillas,128,143
symptoms labor exceeding four hours discomfort partial birth pregnancy past due date,Symptoms,Difficulty Giving Birth in Chinchillas,Chinchillas,12,12
"causes dystocia in chinchillas may be observed with an abnormally large or misplaced fetus, or in young females bred too early. poorly conditioned females may also develop a condition in which uterine contractions weaken or stop, or they may lack sufficient strength to deliver the kits. diagnosis diagnosis is based on the symptoms observed. if the chinchilla has passed the due date and still not delivered, your veterinarian might want to check on your chinchilla’s condition by taking an x-ray of the uterus.",Causes Diagnosis,Difficulty Giving Birth in Chinchillas,Chinchillas,83,92
"treatment if labor continues for more than four hours, your veterinarian would suspect a case of dystocia and administer oxytocin, a medicine that helps labor progress. if the chinchilla continues to experience difficulty giving birth, a cesarean section would be performed. /24, ",Treatment,Difficulty Giving Birth in Chinchillas,Chinchillas,42,48
living and management a chinchilla that has undergone dystocia and is recovering should be given good rest in a clean and safe environment. any supportive care as mentioned by your veterinarian should be administered routinely. chinchillas in post-operative care following a c-section should be given supportive therapy to help the operation wound heal.,Living and Management,Difficulty Giving Birth in Chinchillas,Chinchillas,53,58
"prevention giving a good nutritious diet to your chinchillas and avoiding breeding at a very early age can prevent dystocia due to these causes from developing. it is advisable to take a scan or an x-ray midway through gestation to check for any abnormalities in the fetus. if such cases are found, it is better to terminate the pregnancy to prevent dystocia from developing. /24, ",Prevention,Difficulty Giving Birth in Chinchillas,Chinchillas,65,71
"ear injuries in chinchillas petmd.com /exotic/conditions/ear/c_ex_ch_ear_trauma ear trauma ear injuries (or traumas) are common in chinchillas because of their very delicate ears. fights with other animals or exposure to extreme hot or cold temperatures can frequently bring on these types of injuries. if the ear injury has resulted in deep cuts or wounds, proper veterinary care is needed because it can quickly lead to bacterial or viral infections.",Ear Injuries in Chinchillas Ear Trauma,Ear Injuries in Chinchillas,Chinchillas,68,77
symptoms and types bite marks or deep cuts on its ear swollen and reddened ear fluid discharge excreting from affected ear area in cases of exposure to extreme hot or cold temperatures: a line separating normal and damaged tissue blackened or discolored ears skin sheds (or sloughs),Symptoms and Types,Ear Injuries in Chinchillas,Chinchillas,47,49
"causes ear injuries in chinchillas may be due to a bite from another animal or a self-inflicted wound, or exposure to extreme temperatures. chinchillas with delicate ears are more prone to these type of injuries.",Causes,Ear Injuries in Chinchillas,Chinchillas,35,39
"diagnosis an examination of the chinchilla's ear, along with a through medical history of the animal, may help your veterinarian make a diagnosis for the cause of the ear injury.",Diagnosis,Ear Injuries in Chinchillas,Chinchillas,30,34
"treatment closing cuts with stitches on a chinchilla's ear is generally not effective and is, therefore, not recommended. however, applying antiseptic solutions and antibiotic ointments on the affected area, in addition to dressing the wound, will help prevent infection and aid in healing. if the ear is severely damaged, your veterinarian may recommend removing the damaged portion of the animal's ear. /24, ",Treatment,Ear Injuries in Chinchillas,Chinchillas,62,74
"living and management a chinchilla recovering from an ear injury requires a stress-free, hygienic environment for a quick recovery. it should also be restrained and prevented from grooming the affected area, as it will interfere with wound healing. meanwhile, if the chinchilla has undergone ear cropping surgery, your veterinarian will provide you with a proper supportive care regimen.",Living and Management,Ear Injuries in Chinchillas,Chinchillas,58,66
"prevention avoid mixing chinchillas of different age groups or hostile chinchillas in the same cage. this will help prevent inter-chinchilla aggression. also, be aware and do not leave your chinchilla in extreme temperatures for too long. /24, ",Prevention,Ear Injuries in Chinchillas,Chinchillas,37,43
"hair rings in chinchillas petmd.com /exotic/conditions/reproductive/c_ex_ch_hair_ring rings of hair on the penis of chinchillas if your male chinchilla is experiencing difficulty mating, it may be on account of hair rings. hair rings are a condition that develops in male chinchillas following sexual intercourse in which a ring of hair may surround the penis within the foreskin and cause serious complications, including inability to mate with the female. male chinchillas, especially those used for breeding, should be routinely checked for the presence of hair rings to prevent other complications from developing. you should check for hair rings if your male chinchilla grooms itself more than necessary, has difficulty urinating and/or licks its penis excessively. the veterinarian will treat male chinchillas with hair rings by giving them a mild sedative while removing the hair ring. he or she may even teach you the proper technique for removing hair rings so that you can do it at home. it is important to provide your chinchilla a quiet area to rest and recover after the treatment for hair rings. in addition, keep the recovering male chinchilla separate from a female chinchilla to prevent any attempt at breeding till full recovery.",Hair Rings in Chinchillas Rings of Hair on the Penis of Chinchillas,Hair Rings in Chinchillas,Chinchillas,196,215
symptoms excessive grooming difficulty urinating inability to mate,Symptoms,Hair Rings in Chinchillas,Chinchillas,8,8
causes hair rings often develop following sexual intercourse. a ring of hair may surround the penis within the foreskin and cause a painful condition that may keep the male chinchilla from mating with the female. diagnosis a diagnosis can be made by examining the penis of the male chinchilla. observing the clinical signs exhibited by the male can help you suspect a case of hair ring.,Causes Diagnosis,Hair Rings in Chinchillas,Chinchillas,66,70
"treatment treatment includes lubricating the penis or mild sedation to help with gentle removal of the hair ring. your veterinarian can demonstrate the best technique for hair ring removal. /24, ",Treatment,Hair Rings in Chinchillas,Chinchillas,30,33
living and management males that have been treated for a condition of hair ring should be given rest and not used for breeding until the condition heals.,Living and Management,Hair Rings in Chinchillas,Chinchillas,27,28
"prevention routinely checking male chinchillas for hair rings, especially any males that are used for breeding, will help to identify and treat this condition at the initial stages and thus prevent serious complications from developing. managing the condition in the early stages is the only prevention as hair rings can affect any male chinchilla. /24, ",Prevention,Hair Rings in Chinchillas,Chinchillas,55,60
"have you ever seen your pet chinchilla or guinea pig popcorning? petmd.com /exotic/behavior/have-you-ever-seen-your-pet-chinchilla-or-guinea-pig-popcorning when pet guinea pigs and pet chinchillas are happy, they literally jump for joy. this behavior, frequently called “popcorning” (or less often, “pogoing”—as if jumping up and down on a pogo stick—or “pronking,” “pronging” or “stotting”), happens in both species spontaneously and can be quite confusing to guinea pig and chinchilla owners when they see it for the first time.",Have You Ever Seen Your Pet Chinchilla or Guinea Pig Popcorning?,Have You Ever Seen Your Pet Chinchilla or Guinea Pig Popcorning_,Chinchillas,73,102
"what does chinchilla or guinea pig popcorning look like? with pet chinchilla and guinea pig popcorning, the animals either jump straight up on all four legs from a standing position, like a kernel of popcorn popping in a pan, or they run forward and backward quickly first, sometimes kicking out their front and back legs, like a bucking bull. guinea pigs may run back and forth in different directions first and may make high-pitched squeaking sounds simultaneously. happy chinchillas may also make softer, repeated squeaking sounds. both guinea pigs and chinchillas may spontaneously popcorn once or repeatedly, without anything triggering this behavior, or they may popcorn in response to receiving food or attention. this behavior is more common in younger pet chinchillas and guinea pigs, but may be displayed by adults, as well. guinea pigs may be able to jump several inches in the air, while young chinchillas may attain several feet. older or heavier animals may not be able to jump as high as their younger, spryer counterparts. chinchillas also display happiness by “wall-surfing,” where they run up and down the wall when they are excited. as chinchillas are nocturnal, they may popcorn and wall- surf more often at night because they tend to sleep during the day.",What Does Chinchilla or Guinea Pig Popcorning Look Like?,Have You Ever Seen Your Pet Chinchilla or Guinea Pig Popcorning_,Chinchillas,209,237
