text,topic,blog_name,pet,word_count,chunk_size
"inflammation of the mammary gland in chinchillas petmd.com /exotic/conditions/reproductive/c_ex_ch_mastitis mastitis in chinchillas mastitis happens in female chinchillas when there is inflammation (swelling) in the mammary tissues. it can be due to any cause, the most common being infectious causes. when the kit feeds from its mother, the sharp teeth of the kit might cause injuries in the mammary gland, allowing for the potential entry of infectious agents, which may cause mastitis. this condition needs to be treated by a veterinarian promptly as it might cause permanent damage to the mammary tissue in prolonged cases. you will know your female chinchilla is suffering from mastitis when the milk production is reduced along with changes in the consistency of the milk, which becomes thick and bloody. the female chinchilla will also have difficulty and pain in nursing the kits and also when not nursing. antibiotics will be necessary to treat the condition of mastitis, along with medication to relieve the inflammation. it is advisable to stop the female chinchilla from further nursing.",Inflammation of the Mammary Gland in Chinchillas Mastitis in Chinchillas,Inflammation of the Mammary Gland in Chinchillas,Chinchillas,170,189
symptoms warm mammary glands enlarged mammary glands secretion of thick milk possibly containing blood,Symptoms,Inflammation of the Mammary Gland in Chinchillas,Chinchillas,14,14
"causes mastitis in chinchillas occurs as a result of injuries caused by the sharp teeth of nursing kits. minor cuts do not get infected but more serious wounds can lead to secondary bacterial infection, which can lead to inflammation of the mammary glands. diagnosis the mammary glands of nursing females should be observed frequently for injuries caused by the sharp teeth of nursing kits. diagnosis is made by a combination of the history provided by the owner and the symptoms observed. blood tests may be necessary to find out the exact nature of the infectious agent causing the condition so that appropriate treatment could be provided.",Causes Diagnosis,Inflammation of the Mammary Gland in Chinchillas,Chinchillas,106,112
"treatment the veterinarian will treat mastitis with antibiotics to clear the infection. anti- inflammatory and antihistaminic agents would also be administered to help reduce the inflammation. if the cut or wound is deep, regular dressing and topical antibiotic /24, or antiseptic ointments will be applied.",Treatment,Inflammation of the Mammary Gland in Chinchillas,Chinchillas,45,51
living and management the kits should not be allowed to feed from the mother suffering from mastitis. kits may need to be nursed by other nursing females or hand fed. routinely administer the necessary antibiotics as directed by your veterinarian and follow the regular dressing of the wound until it heals.,Living and Management,Inflammation of the Mammary Gland in Chinchillas,Chinchillas,51,54
"prevention the mammary glands of nursing females should be observed frequently for injuries caused by the sharp teeth of nursing kits. any such injury should be immediately attended to by proper dressing and antibiotic treatment to heal so that secondary bacterial infection leading to mastitis does not occur. /24, ",Prevention,Inflammation of the Mammary Gland in Chinchillas,Chinchillas,49,52
"lack of milk in chinchillas petmd.com /exotic/conditions/reproductive/c_ex_ch_lack_of_milk agalactia, dysgalactia in chinchillas a lack of milk production sometimes occurs in females that have recently given birth. this is more specifically classified into two main types: agalactia, a complete absence of milk secretion; or dysgalactia, an incomplete or improper secretion of milk to meet the needs of the kits. lack of milk may be due to many causes from nutritional to infectious and it requires proper veterinary attention.","Lack of Milk in Chinchillas Agalactia, Dysgalactia in Chinchillas",Lack of Milk in Chinchillas,Chinchillas,76,88
symptoms insufficient production of milk kits appear malnourished red and swollen mammary glands small and underdeveloped mammary glands,Symptoms,Lack of Milk in Chinchillas,Chinchillas,18,18
causes age (very young or old) underdeveloped mammary glands infectious causes such as mastitis (inflammation of the mammary glands) malnutrition,Causes,Lack of Milk in Chinchillas,Chinchillas,20,22
"diagnosis diagnosis is based on the history provided by the owner as well as the clinical signs exhibited. for example, your veterinarian will suspect this condition if females have not begun to produce adequate milk within 72 hours of giving birth. blood tests may be necessary if an infectious cause is suspected as the reason for the lack of milk production.",Diagnosis,Lack of Milk in Chinchillas,Chinchillas,61,65
treatment if milk secretion has not started by 72 hours of giving birth the veterinarian will administer oxytocin injections to improve flow of milk. oral calcium supplements may also be given to improve secretion of milk.,Treatment,Lack of Milk in Chinchillas,Chinchillas,36,38
"living and management follow the supportive care routines set forth by your veterinarian. allowing kits to nurse from compatible nursing female chinchillas may be an option necessary in unresponsive cases or large litters. otherwise, hand feeding is another option. your veterinarian will advise you about the best methods and strategies that will be adaptable for treatment of your female chinchilla. /24, ",Living and Management,Lack of Milk in Chinchillas,Chinchillas,61,67
"prevention giving your pet chinchilla a good nutritious and well-balanced diet can help to prevent this condition from arising due to poor nutrition. promptly treating any infectious conditions may also minimize the incidences of lack of milk due to infectious agents. /24, ",Prevention,Lack of Milk in Chinchillas,Chinchillas,42,46
"middle ear infection in chinchillas petmd.com /exotic/conditions/ears/c_ex_ch_otitis_media otitis media in chinchillas otitis media is an infection of the middle ear that often affects young chinchillas. there are two primary reasons for this condition: infection and external ear trauma. when the ear is injured, the injuries may serve as entry points for infectious bacteria which may cause infection. also, the scar tissue that forms during healing of the wound can enclose the ear canal and trap wax and debris inside which in turn becomes a source of infection. the eardrum may become thick and swollen. the swelling may progress to the inner ear, which will result in the development of otitis media. usually the treatment of otitis media is through antibiotics unless the ear canal is closed. regular cleansing and dressing are of utmost importance too for complete healing. the underlying causes of otitis media should be treated as well.",Middle Ear Infection in Chinchillas Otitis Media in Chinchillas,Middle Ear Infection in Chinchillas,Chinchillas,149,166
symptoms disorientation fever pain in the ears,Symptoms,Middle Ear Infection in Chinchillas,Chinchillas,7,7
causes respiratory infections trauma to external ear diagnosis diagnosis is made by the clinical signs observed. blood tests and swabs tests may also be administered.,Causes Diagnosis,Middle Ear Infection in Chinchillas,Chinchillas,25,27
"treatment your veterinarian will, in severe cases of infection, gently flush the ear canal and administer antibiotic eardrops. oral antibiotics and painkillers may be prescribed to help relieve the infection and pain. a closed ear canal will require surgical reopening. living and management your pet chinchilla should be given rest in a calm and quiet environment. if possible, house the animal separately so that it is not disturbed. if your animal is recovering from a surgery to reopen a closed ear canal, then proper postoperative care as /24, suggested by your veterinarian should also be given. while the chinchilla is recovering it requires regular cleaning of the surgical site and antibiotics to ensure complete healing without complications.",Treatment Living and Management,Middle Ear Infection in Chinchillas,Chinchillas,117,129
"prevention otitis media can be prevented in chinchillas by immediately tending to cases of external ear injuries and also treating respiratory infections promptly so that infection does not spread to the middle ear. regularly cleaning the ear also prevents the build- up of wax and debris and the development of infection. ask your veterinarian to show you how to safely clean the ears. following these steps can help prevent the incidence of otitis media in chinchillas. /24, ",Prevention,Middle Ear Infection in Chinchillas,Chinchillas,77,83
"neurological infection (protozoa) in chinchillas petmd.com /exotic/conditions/neurological/c_ex_ch_protozoa protozoa in chinchillas protozoal infections are quite rare in chinchillas. certain protozoa (single-cell parasites) cause a disease called necrotic meningoencephalitis. when chinchillas are affected with protozoal infection they exhibit signs of nervous system derangement due to inflammation of the brain and its associated membranes. it is difficult to diagnose protozoal infection and usually the confirmatory diagnosis is possible only after post-mortem examination of the brain tissue. protozoal infections in chinchillas are symptomized by lack of coordination, lethargy, lack of appetite, listlessness, weight loss, respiratory difficulty, thick yellowish nasal discharge and cyanosis (bluish discoloration of the skin due to lack of oxygen in the tissues). usually the treatment is symptomatic with antibiotics and antihistamines for various symptoms. however, a general treatment directed towards the infecting protozoa is not possible. it is best to prevent the protozoal infection by maintaining hygienic living environment for your chinchilla. the food and water provided to the chinchilla should be fresh and free of any contamination.",Neurological Infection (Protozoa) in Chinchillas Protozoa in Chinchillas,Neurological Infection (Protozoa) in Chinchillas,Chinchillas,167,192
symptoms poor coordination inactivity depression loss of appetite weight loss difficulty breathing blue discoloration of the skin pus-like discharge from the nose,Symptoms,Neurological Infection (Protozoa) in Chinchillas,Chinchillas,22,23
causes protozoal infection in chinchillas is caused by certain protozoa that infect the brain and cause inflammation of the brain and its meninges.,Causes,Neurological Infection (Protozoa) in Chinchillas,Chinchillas,23,24
"diagnosis non-specific clinical signs exhibited suggesting nervous system involvement will make your veterinarian suspect apart from other causes protozoal infection also. however, a confirmation of the diagnosis is only possible during postmortem examination of the infected chinchilla when certain characteristic lesions may be /24, observed in the central nervous system of the infected chinchilla. isolation of the microbe from the brain of the infected chinchillas after postmortem examination also helps in confirming the diagnosis.",Diagnosis,Neurological Infection (Protozoa) in Chinchillas,Chinchillas,74,80
treatment treatment specifically directed against protozoal diseases in chinchillas is not practical. some active infections are treatable with antibiotics. symptomatic treatment to deal with the seizures and rhinitis may be provided by your veterinarian as a short-term relief.,Treatment,Neurological Infection (Protozoa) in Chinchillas,Chinchillas,38,42
"living and management surviving chinchillas should be maintained separately and handled carefully. a well- balanced, fresh diet will help the chinchilla recover quickly.",Living and Management,Neurological Infection (Protozoa) in Chinchillas,Chinchillas,23,27
"prevention make sure that the food and water given to your chinchilla is fresh and uncontaminated. maintain good sanitation and a clean environment inside your chinchilla’s cage to reduce the chances of protozoal infection. /24, ",Prevention,Neurological Infection (Protozoa) in Chinchillas,Chinchillas,35,39
"overgrown, painful teeth in chinchillas petmd.com /exotic/conditions/mouth/overgrown-teeth-and-dental-issues-chinchillas by laurie hess, dvm, diplomate abvp (avian practice) chinchillas’ teeth, like those of other rodents, such as guinea pigs and degus, are open-rooted and grow continuously throughout their lives. wild chinchillas have evolved this type of teeth to adapt to prolonged chewing on the rough shrubbery and vegetation they survive on in the andes mountains where they live. their front teeth — the incisors — can grow as much as 2-3 inches per year!","Overgrown, Painful Teeth in Chinchillas","Overgrown, Painful Teeth in Chinchillas",Chinchillas,81,103
"what causes tooth overgrowth in pet chinchillas? pet chinchillas typically are not fed the same type of abrasive foods their wild counterparts consume. instead of eating coarse vegetation, they are generally fed dry pellets that crumble in their mouths, requiring little to no chewing, as well as some hay. hay consumption encourages chewing but not at the same frequency as that performed by wild chinchillas. thus, pet chinchillas’ teeth grow as rapidly as wild chinchillas’, but pets don’t spend as much time chewing, so their teeth may grow in faster than they are worn down. genetic factors as well may predispose to teeth overgrowth. both incisors and back teeth (or “cheek teeth”) can become overgrown. both the portions of the teeth visible in the mouth (the crowns), as well as the parts of the teeth below the gums (the roots) that are not visible inside the mouth, may become elongated. as a result, the crowns visible inside the mouth may look step- like or wavy, while the roots may feel bumpy and irregular when the upper and lower jaws are palpated on the face. the crowns may develop sharp edges and points from irregular wear, causing ulcers and sores on the gums and inside the cheeks. elongated roots below the gum line may become painful and impacted, like impacted wisdom teeth in people, and ultimately may become infected, evolving into large facial abscesses.",What Causes Tooth Overgrowth in Pet Chinchillas?,"Overgrown, Painful Teeth in Chinchillas",Chinchillas,233,266
"what are the signs of overgrown teeth in pet chinchillas? if a chinchilla’s incisors are overgrown, they may appear excessively long when the upper and lower lips are gently lifted. bumpy swellings may be palpable especially along the lower jaw when an owner runs a hand over the jaw from front to back. even before they show these obvious abnormalities, chinchillas affected with dental problems may simply drool more, eat slower, select out softer or easier to chew foods, or eat less overall. their fecal pellets may become smaller, drier, and less frequent. affected chinchillas may gradually lose weight and develop matted fur or fur loss on around their mouths, chins, and front paws from excessing drooling. if impacted teeth roots grow into the tear ducts that run under the skin on their faces, affected chinchillas also may show excessive tearing. /24, ",What Are the Signs of Overgrown Teeth in Pet Chinchillas?,"Overgrown, Painful Teeth in Chinchillas",Chinchillas,142,161
"what should a chinchilla owner do if he or she notices these signs? owners who observe any of these signs in their pets should have them examined by a veterinarian as soon as possible. delaying the veterinary visit simply leads to worsening of signs and often a poorer prognosis. a chinchilla-savvy veterinarian will not only perform a thorough physical examination, including a comprehensive oral examination using an oral speculum to look at the cheek teeth, but also take x-rays of the head to see the tooth roots not visible from inside the mouth. very stressed or active chinchillas that will not allow a speculum examination may need to be sedated for examination and x-rays. prognosis depends on what the veterinarian finds. chinchillas with early disease involving crown overgrowth or sharp points on the crowns, with normal looking roots on x-rays, may require crown reduction, in which the surfaces of the elongated teeth within the mouth are filed down so that crowns are shorter, even, and smooth. more severely affected animals whose x-rays show elongation and impaction of teeth roots may require long term pain medication to lessen discomfort on chewing. those animals with advanced disease that have developed facial abscesses require surgical removal of infected teeth and debridement of the abscess, as well as treatment with antibiotics, pain killers, and anti-inflammatories. very severely affected chinchillas may need to be fed soft foods or even be supplemented with syringe feeding a gruel-like formula to maintain their weight. dental problems in chinchillas are lifelong and typically require repeated treatment. owners of chinchillas with dental problems should be prepared for recurrent trips to the veterinarian and the long-term expense that goes with these visits.",What Should a Chinchilla Owner Do if He or She Notices These Signs?,"Overgrown, Painful Teeth in Chinchillas",Chinchillas,281,311
how can chinchilla owners try to prevent dental issues in,How Can Chinchilla Owners Try to Prevent Dental Issues in,"Overgrown, Painful Teeth in Chinchillas",Chinchillas,10,10
"their pets? the best way to try to prevent overgrown teeth in chinchillas is to feed them as much hay as possible. hay is coarse fiber that not only promotes prolonged chewing but also encourages a healthy gastrointestinal (gi) tract by helping establish a normal population of gi bacteria that digests the food they eat. some chinchillas, like some people, are genetically predisposed to dental problems. by taking their pets for regular, annual veterinary check-ups and by being attentive to their animals’ food consumption, stool production, and weight, chinchilla owners can help catch signs of dental disease early before this disease develops into a significant, life-threatening problem. /24, /24, ",Their Pets?,"Overgrown, Painful Teeth in Chinchillas",Chinchillas,109,127
"pneumonia in chinchillas petmd.com /exotic/conditions/respiratory/c_ex_ch_pneumonia what is pneumonia in chinchillas? pneumonia occurs when there is irritation and inflammation of the lung tissue. this often causes fluid or pus to build up in the air sacs, which causes breathing difficulty. pneumonia is uncommon in chinchillas, but can occur. pneumonia is a medical emergency and requires immediate medical treatment by your veterinarian.",Pneumonia in Chinchillas What Is Pneumonia in Chinchillas?,Pneumonia in Chinchillas,Chinchillas,60,71
"types of aspiration pneumonia occurs when food or liquid gets accidentally inhaled into the lungs. this is uncommon in chinchillas but it can occur due to underlying dental disease. chinchillas can also choke on foreign material if food gets lodged in the trachea. the entrance of the trachea can be obstructed with food or foreign material in chinchillas. this can lead to lots of inflammation, irritation, and swelling. chinchillas will cough as an attempt to remove the material, but chinchillas can deteriorate rapidly, suffocate, and die if not treated immediately. bacterial pneumonia develops when a bacterial organism infects the air sacs of the lungs. chinchillas can develop bacterial pneumonia from bacteria including: pasteurella, bordetella, streptococcus, and other bacterial organisms. fungal pneumonia occurs when a fungal organism infects the lung air sacs. this is not common in chinchillas.",Types of Pneumonia in Chinchillas,Pneumonia in Chinchillas,Chinchillas,137,156
"symptoms of anorexia and weight loss poor hair coat lethargy difficulty breathing, increased/fast breathing, wheezing, open-mouth breathing nasal or eye discharge swollen lymph nodes abdominal breathing /24, ",Symptoms of Pneumonia in Chinchillas,Pneumonia in Chinchillas,Chinchillas,27,33
"is pneumonia contagious to other chinchillas? bacterial pneumonia can be contagious to other chinchillas, so it is important to isolate symptomatic chinchillas away from other chinchillas while they are contagious. correct any environmental issues such as poor ventilation or overcrowding so other chinchillas do not get stressed and also develop pneumonia.",Is Pneumonia Contagious To Other Chinchillas?,Pneumonia in Chinchillas,Chinchillas,51,55
"causes of pneumonia typically occurs in chinchillas with a weaker immune system, either very young or very old. the immune system can also be compromised due to other diseases, stress due to overcrowding, aggression from other cage mates, and poor environmental conditions. environmental conditions that can predispose chinchillas to pneumonia include poor ventilation, high heat, overcrowding, and high humidity greater than 70%. aspiration pneumonia or choking is caused by inhalation of food, foreign material, or liquids. bacterial pneumonia is caused by bacteria that are inhaled into the lungs and form an infection if the immune system is weakened. bordetella, streptococcus, and pasteurella are most common. fungal pneumonia is caused by fungal spores inhaled into the lungs forming an infection. although this is not common in chinchillas, it has been reported and associated with poor hay quality, moist environments, and a compromised immune system. the fungus histoplasma capsulatum has been associated with hay and pneumonia in chinchillas.",Causes of Pneumonia in Chinchillas,Pneumonia in Chinchillas,Chinchillas,156,180
"how veterinarians diagnose a veterinarian will diagnose pneumonia through a thorough medical history, physical examination, and diagnostic tests. your veterinarian may recommend the following: chest x-rays to evaluate the lung tissue and look for any signs pointing to bacterial or fungal pneumonia. culture and sensitivity tests or a tracheal wash to identify if bacteria is the root cause. bloodwork to evaluate any changes to organ function, look for any evidence of anemia, elevated white blood cells due to infection, and any other abnormalities. ct scan of head if there is concern for dental disease predisposing your chinchilla to pneumonia /24, ",How Veterinarians Diagnose Pneumonia in Chinchillas,Pneumonia in Chinchillas,Chinchillas,100,112
treatment of treatment for pneumonia depends on its type and the severity of symptoms. aspiration pneumonia and bacterial pneumonia is treated with broad spectrum antibiotics. fungal pneumonia is treated with antifungal medication. additional treatments may include: supportive care such as intravenous or subcutaneous fluid therapy nebulization to keep the airways moist or to deliver medication bronchodilators nonsteroidal anti-inflammatories topical eye drops nutritional support through hand feeding formulas chinchillas may require hospitalization in an oxygen chamber depending on the severity of debilitation.,Treatment of Pneumonia in Chinchillas,Pneumonia in Chinchillas,Chinchillas,81,87
"recovery and management of if respiratory disease is moderate and the disease is caught early, typical treatment can last anywhere from two to eight weeks—longer if signs and symptoms persist. prognosis is poor when there is respiratory distress due to pneumonia. chinchillas can also become septic or have blood poisoning which complicates treatment and can unfortunately become fatal. it is important to monitor your chinchilla daily. if they start to show signs of respiratory distress again, have soft stools, or decreased appetite, contact your veterinarian immediately.",Recovery and Management of Pneumonia in Chinchillas,Pneumonia in Chinchillas,Chinchillas,86,96
"references quesenberry, katherine, and james w. carpenter. elsevier health sciences. ferrets, rabbits and rodents-e-book: clinical medicine and surgery. 2011. jörg mayer, donnelly tm. clinical veterinary advisor. elsevier/saunders. birds and exotic pets. 2013. johnson, dan. the pneumonias of small mammals. 2009. merck veterinary manual. chinchillas - exotic and laboratory animals. /24, garner, michael m. ""diseases of pet hedgehogs, chinchillas, and sugar gliders."" proceedings of the association of avian veterinarians. 2011. meredith, anna, and cathy johnson delaney. ""bsava manual of exotic pets 5th edition."" 2010. /24, ",References,Pneumonia in Chinchillas,Chinchillas,84,124
"pregnancy loss (miscarriage) in chinchillas petmd.com /exotic/conditions/reproductive/c_ex_ch_abortion abortion or resorption of fetuses a spontaneous abortion (or miscarriage) can occur in chinchillas due to a wide variety of reasons, including stress, trauma, and fever. if left untreated, the condition may lead to infections of the female's uterus and vagina. hence, a chinchilla that has just undergone a miscarriage must be taken to veterinarian immediately.",Pregnancy Loss (Miscarriage) in Chinchillas Abortion or Resorption of Fetuses,Pregnancy Loss (Miscarriage) in Chinchillas,Chinchillas,63,78
"symptoms pregnancy loss generally occurs spontaneously and may go unnoticed. the most common signs of the condition being a bloody or purulent vaginal discharge and/or staining near the animal's vagina. (in prolonged cases, the discharge may have a foul odor.) it may also have swelling in the vaginal area, sudden weight loss, and an expelled fetus may be found.",Symptoms,Pregnancy Loss (Miscarriage) in Chinchillas,Chinchillas,59,69
"causes fever stress trauma improper handling poor nutrition bacterial infection interruption of the blood supply to the uterus in addition, if the female chinchilla is suddenly scared or startled during birthing time it may undergo an abortion.",Causes,Pregnancy Loss (Miscarriage) in Chinchillas,Chinchillas,37,39
