text,topic,blog_name,pet,word_count,chunk_size
"5 fun facts about chinchillas petmd.com /exotic/fun-facts-about-chinchillas what is a chinchilla? chinchillas are small social rodents known for their soft, plush fur as well as their quiet and shy demeanor. they are agile and athletic with the ability to climb well and jump up to six feet. chinchillas require constant chewing to keep their continually growing teeth trimmed. they often sit upright to sunbathe, groom, and to eat with their front paws. chinchillas can make great family pets due to their small size and are comparable to a small cat or rabbit. they are naturally clean and odorless. their timid, peaceful demeanor is better suited for adults and older children. chinchillas are mostly active around dawn and dusk and tend to be more awake at night. a few fun facts about chinchillas include the following:",5 Fun Facts About Chinchillas What Is a Chinchilla?,5 Fun Facts About Chinchillas,Chinchillas,135,154
"#1 baby chinchillas are called kits baby chinchillas are known as kits and are born fully covered in fur. they weigh between 30–60 grams or 1–2 ounces. at birth, chinchilla eyes and ears are open and functional, making them one of the most independent newborn animals. the average chinchilla litter size is two kits but may range from one to six. they will reach sexual maturity around eight months of age.",#1 Baby Chinchillas Are Called Kits,5 Fun Facts About Chinchillas,Chinchillas,71,80
"#2 chinchillas like dust baths chinchillas will take occasional dust baths to keep their fur conditioned. their fur should not be bathed in water or get wet since it takes too long to dry and may cause the skin to become inflamed. a dust bath will counter their naturally oily skin and helps maintain the softness of their fur. these dust baths should be offered to pet chinchillas at least two to three times per week. offering too frequent dust baths may dry out their skin. a chinchilla bath house or a plastic dishpan container that measures 6” x 6” x 12” may be filled with chinchilla dust 1–2 inches deep. it may be offered for an hour at a time or maintained with daily cleaning and weekly replacement of the dust. sand should not be used as it may cause irritation of the skin or eyes and may damage the fur. recommended products: oxbow poof! chinchilla dust bath, blue cloud, 2.5-lb jar brytin all-natural chinchilla dust bath, 2.5-lb bag /24, kaytee chinchilla dust bath, 2.5-lb jar kaytee chinchilla dust bath house, color varies, 9-in lixit chinchilla dry bath, blue/white",#2 Chinchillas Like Dust Baths,5 Fun Facts About Chinchillas,Chinchillas,190,221
"#3 chinchilla coats make the species endangered chinchillas have very dense fur that has up to 60 hairs per follicle and 20,000 hairs per square inch which causes it to feel very soft and fluffy. this makes chinchilla fur desirable to fur traders who have over-hunted them to near extinction. chinchillas are native to western south america and make their home in the rocky slopes of the andes mountains. the species c. chinchilla is especially sought after for their higher quality fur and larger size than the common domesticated species c. lanigera . chinchillas are currently on the endangered list and are protected in the wild. their numbers continue to decline due to loss of habitat and excessive trapping.",#3 Chinchilla Coats Make the Species Endangered,5 Fun Facts About Chinchillas,Chinchillas,119,128
"#4 chinchilla lifespans are longer than many small pets chinchillas are expected to live between 10–15 years in captivity, though in the wild they are only expected to live 8–10 years due to the threat of predators including humans. this makes chinchillas much longer lived than other small pets such as guinea pigs or hamsters. one theory for why chinchillas have a longer lifespan than other small pet species is that their physical development is delayed in comparison. another possible explanation is that chinchillas have fewer overall health concerns as a species.",#4 Chinchilla Lifespans Are Longer Than Many Small Pets,5 Fun Facts About Chinchillas,Chinchillas,92,99
"#5 chinchillas are pets for every family chinchillas can be great family pets due to their small size and quiet nature. while they are naturally clean and odorless, they can also be potty trained. they enjoy bonding with their pet parents or another same-gender chinchilla. they have simple dietary requirements, and are less active during the daytime, which is ideal for pet parents that are busy or away. /24, ",#5 Chinchillas Are Pets for Every Family,5 Fun Facts About Chinchillas,Chinchillas,69,78
"51 common diseases that affect chinchillas petmd.com /exotic/care/common-illnesses-chinchillas by dr. laurie hess, dvm, diplomate abvp (avian practice) chinchillas are rodents that are generally hardy pets. however, they do commonly develop a handful of problems that all chinchilla owners should be familiar with. if chinchilla owners are educated about conditions their pets potentially could develop, they can recognize abnormal signs in their animals and have them treated by a veterinarian as soon as possible to improve the chances of recovery. common illnesses in chinchillas include:",51 Common Diseases That Affect Chinchillas,51 Common Diseases That Affect Chinchillas,Chinchillas,84,99
"dental disease chinchillas have open-rooted or continuously growing teeth that grow 2-3 inches per year. in the wild, they eat rough, coarse grasses that help keep these continuously growing teeth worn down. many pet chinchillas are fed excessive amounts of dry, crumbly pellets, rather than fibrous hay, and as a result, they don’t chew enough and their teeth don’t wear down properly as they grow. in addition, their top and bottom teeth must meet properly to help wear them down as they grow. a condition called malocclusion occurs when the teeth don’t align properly, so that the teeth surfaces hit each other inside the mouth. once the teeth grow so long that they hit, there is no room for them to grow longer, and they become impacted in the gums and jaw bone (like wisdom teeth in people). both the front (incisor) teeth and back (molar) teeth can become impacted — a very painful condition when the chinchilla tries to chew. overgrown, sharp edges may form along teeth surfaces, leading to cuts on the tongue, cheek, or lips. the roots of overgrown teeth may become infected and abscessed. the chinchilla may have difficulty eating, lose weight, drool, and paw at its mouth. if an owner sees a chinchilla exhibiting any of these signs, the animal should be examined by a veterinarian right away so that treatment may be started. a chinchilla-savvy vet should perform a thorough oral examination and take x-rays of the animal’s head to assess the teeth roots. if the teeth are overgrown and impacted but not infected, the pet should be started on a softer, easier-to-chew diet (such as shredded veggies and chopped hay), or syringe-fed a liquid diet if it cannot chew at all. it should also be given liquid anti-inflammatory medication. if x-rays show infected teeth roots, the infected teeth must be surgically extracted under anesthesia. prognosis for chinchillas with dental disease is better when the animal is treated early on, before they become weak and thin. in general, however, dental problems in chinchillas are recurrent and lifelong. related /24, overgrown teeth and dental issues in chinchillas",Dental Disease,51 Common Diseases That Affect Chinchillas,Chinchillas,352,412
"ringworm chinchillas are common carriers of ringworm — a fungal (not a parasite or worm) skin infection that causes hair loss and crusty, scaly skin, and which is transmissible to people and other pets. skin on the ears, face, and legs is commonly affected; however, chinchillas have very dense fur and can carry microscopic ringworm spores on their thick haircoat without actually showing any signs. owners who notice dry, flaky skin or patches of hair loss on their pets should have them examined by a veterinarian immediately. a veterinarian can diagnose ringworm by culturing the affected skin in special fungal culture media or by having a veterinary laboratory run dna tests on the hair to see whether fungus is present. treatment involves thorough clean-up of all areas in which the chinchilla has been in contact to ensure that no infectious hair is left behind that could re-infect the affected animal, other animals, or people. mildly affected animals can be treated with topical prescription medications applied to the areas of infected skin. more severely affected animals may require long-term treatment with oral prescription medications, as well.",Ringworm,51 Common Diseases That Affect Chinchillas,Chinchillas,185,206
"fur issues chinchillas commonly develop two conditions that involve their fur. first, fur chewing in chinchillas is a common behavioral problem in which they chew on their own or their cage mates’ fur so that the haircoat looks patchy. hair growing back into the chewed regions may be shorter and darker than the original fur. chewing occurs most often over the back and tail but can occur anywhere on the body. theories about why chinchillas do this include stress, hormone imbalances, dietary deficiencies, underlying dental problems, boredom, the presence of other (parasitic or fungal) skin infections, and a genetic predisposition. the most widely accepted explanation is that fur chewing is a displacement behavior in response to environmental stress, such as from an overcrowded cage, the presence of aggressive cage mates or other predatory pets (such as cats and dogs), too frequent handling, or other anxiety-inducing circumstances. a veterinarian can diagnose fur chewing by performing a thorough physical examination and skin tests to eliminate the presence of infections such as ringworm. proper diet must be assured, too, to rule-out dietary deficiencies. the cause of fur chewing may be difficult to pinpoint; treatment may include elimination of possible stressors by providing a larger cage, handling the pet less often, removing other pets or aggressive cage mates, and ensuring a proper diet. offering other, more appropriate things to chew on, such as hay and wooden toys, also may help. /24, the second common fur issue that occurs in chinchillas is fur slip. fur slip is another name for the release of a large patch of fur in response to being grabbed or handled roughly. wild chinchillas have developed this mechanism to escape predators when they are captured. they release big clumps of hair to get out of a predator’s mouth when the predator grabs them. with normal shedding, chinchillas lose small amounts of fur gradually from all over their bodies as hair ages, falls out, and is replaced by new hair growing underneath. this process is gradual, so that obvious bald spots aren’t visible. with fur slip, however, a traumatic event precedes the hair loss, a large amount of hair comes off all at once, and a clean, smooth, bald patch is left behind. short, stubbly hairs may grow back in the bald patch within a few weeks after fur slip occurs, but return to a full, thick, normal coat may take up to several months. owners can prevent fur slip from happening by never grabbing the animal directly by the fur or skin and by always supporting the pet’s body from underneath the chest, abdomen, and hind end. also, owners should never allow other naturally predatory pets, such as cats and dogs, near their chinchillas. these other pets may be good- natured and well-intentioned in carrying the chinchilla in their mouths to play with it, but may actually cause fur slip or worse injuries. related is your chinchilla going bald? it may be a case of fur slip",Fur Issues,51 Common Diseases That Affect Chinchillas,Chinchillas,496,569
"heat stroke wild chinchillas live in the andean mountains where it is cold; they have developed a thick fur coat to keep them warm in a cool climate. but as pets, chinchillas are very susceptible to overheating. they function best at environmental temperatures ranging from 55-70°f and should never be exposed to temperatures above 80°f. they also don’t do well with high humidity. during the summer, or in warm climates, they should be kept indoors in air conditioned, dry areas, and they should never be exposed to direct sunlight without access to shade. a chinchilla suffering from heatstroke appears weak and may be collapsed; it will need to be treated by a veterinarian immediately to cool it off with fluids injected beneath the skin, a sponge bath, and direct air flow from a fan. chinchillas with heatstroke must be treated as soon as possible or they risk stroke, organ failure, brain injury, and even death. related /24, heat stress in chinchillas",Heat Stroke,51 Common Diseases That Affect Chinchillas,Chinchillas,161,185
"gastrointestinal problems gastrointestinal (gi) problems in chinchillas occur secondarily to other systemic illnesses and to other conditions that cause stress or pain. chinchillas with gi disease may have decreased appetite, lethargy, decreased to no stool production, diarrhea, prolapsed (sticking outside the anus) rectal tissue, and a bloated, gas-filled belly. several causes of gi disease in chinchillas exist, including sudden diet change, feeding excessive amounts of carbohydrates (typically chinchilla pellets) or vegetables, a reaction to treatment with antibiotics, gi parasite infection, and overgrowth of abnormal intestinal bacteria or yeast. chinchillas with any of these signs should be seen by a veterinarian as soon as possible. a veterinarian performing a diagnostic work-up for gi disease in a chinchilla might do a stool examination for parasites, abdominal x-rays, bacterial culture of stool, blood testing, and abdominal ultrasound. once the veterinarian determines the cause of the chinchilla’s gi signs, in addition to specific treatment of the underlying cause, he or she can provide general supportive care for gi disease, including subcutaneous fluid administration, syringe feeding, pain relief, treatment with antibiotics and/or anti- yeast medications, and gas-relieving agents, as indicated. emergency surgery may be warranted in cases where a chinchilla is severely bloated or has ingested a foreign object that is obstructing the passage of food through the intestinal tract, but animals with these conditions are usually extremely debilitated and are poor surgical candidates. rectal prolapse, often associated with gi parasites and overgrowth of abnormal gi bacteria or yeast, generally requires surgery. /24, ",Gastrointestinal Problems,51 Common Diseases That Affect Chinchillas,Chinchillas,248,293
"8 pets that may keep you up at night petmd.com /pets-may-keep-you-night some pets do most of their activities at night—when most people are asleep. it’s important to keep a pet’s natural wake/sleep schedule in mind when choosing one for your family. while most pets can adapt to a pet parent’s attention during the day, their instinct is to do most of their more active behaviors, like exploring and playing, at odd hours.",8 Pets That May Keep You up at Night,8 Pets That May Keep You up at Night,Chinchillas,72,88
"nocturnal pets vs. crepuscular pets many animals that are active at night fall into one of two groups: nocturnal or crepuscular. nocturnal animals become active when the sun goes down and are generally more or less awake for the entire night, unless they decide to grab a nap. crepuscular animals have two main periods of activity: near dawn and dusk. these critters are typically up a little before the sun sets in the evening and are active until a few hours after it sets. they then go to bed and catch a long nap until shortly before dawn. at this point, they get up again, are active for a few hours after dawn, then sleep during the day.",Nocturnal Pets vs. Crepuscular Pets,8 Pets That May Keep You up at Night,Chinchillas,118,131
"nocturnal pets 1. hamster hamsters are nocturnal and best suited to households that are active after dark, without any early risers. this is because hamsters are one of the louder nocturnal pets—they like to run on their wheels for long hours and chew noisily at anything they can. do not place hamster cages where people sleep. a place that’s also quieter during the day (when the hamster wants to sleep) is ideal. hamsters are often very grumpy when awakened, so if it’s necessary to wake up your pet (for example, for a trip to the vet), it’s best to do so slowly. when possible, it’s best to leave a sleeping hamster asleep.",Nocturnal Pets 1. Hamster,8 Pets That May Keep You up at Night,Chinchillas,112,131
"2. rat rats require a lot of time and socialization, and they thrive on attention. though they’re nocturnal rodents that prefer to be active overnight, rats are also willing to get up during the day if that’s what’s necessary to spend time with their people. but if it /24, were up to them, they’d be most active in the early evening, through most of the night, and in the early morning. overnight, rats love to play in groups. they enjoy climbing, and ladder toys made for birds are some of their favorite objects to scale. rats will also use running wheels, so keeping their cage outside of your bedroom is a good idea.",2. Rat,8 Pets That May Keep You up at Night,Chinchillas,113,133
"3. hedgehog hedgehogs are largely solitary creatures that tend to do most of their exploring and foraging in the evening. although some will make noise while they run on wheels or play, many quietly explore their environment, looking for tasty snacks that might be hiding in the nooks and crannies of their homes. in addition to being primarily nocturnal, hedgehogs also need an area to retreat to that’s always warm. a night heat lamp (like one used for reptiles) or a chew-safe heating pad is an essential part of their cage. don’t surprised if your hedgie basks in that area all day long, even if it seems warm to you!",3. Hedgehog,8 Pets That May Keep You up at Night,Chinchillas,110,124
"4. sugar glider sugar gliders are strictly nocturnal and spend much of their night actively gliding, foraging, and playing. like hedgehogs, they also need at least one part of their cage to be warmer than the environmental temperature. sugar gliders can be entertained by hiding components of their diet throughout the environment to allow for hunting. luckily, most sugar gliders are not noisy household companions. however, they do have a fairly strong and distinct smell, which not all people will appreciate. as such, it may be best to plan to place their cage in a non-central, quieter part of the house.",4. Sugar Glider,8 Pets That May Keep You up at Night,Chinchillas,101,117
"5. mouse mice are active creatures at night, often up running on wheels, chewing, and scratching at corners in their cage. although they are small, mice can make some mighty noises that can bother sleeping humans. they’re best kept in small, same-sex groups (although males may fight), which can elevate the noise as they play and squeak at one another. for sound sleep, keep them outside of your bedroom.",5. Mouse,8 Pets That May Keep You up at Night,Chinchillas,69,84
crepuscular pets,Crepuscular Pets,8 Pets That May Keep You up at Night,Chinchillas,2,2
"1. cat cats do great with families that have hectic schedules, as they can meld around the chaos well. however, despite their tendency to sleep 12–16 hours a day, they are also good at waking us up sometimes for attention or food. /24, as a crepuscular species, your cat may choose to get up at night to grab a snack, play with some toys, or just sit and stare at you, hoping you’ll get up and play. they may accompany you on trips to the bathroom overnight or try their best at the crack of dawn to get you to fill the food bowl. these are all very normal behaviors. 2. chinchilla chinchillas are petite rodents with adorable large eyes and ears. much like cats, chinchillas are crepuscular; although they may be up at night, they prefer to be active in the early evening and early morning. you can spend time with them before you go to bed and when you first get up, and they will be happy to see you. chinchillas also tend to spend some time being active overnight and can be noisy. they like to climb, jump, run, and chew, so they also need very large areas to be active over the nighttime hours.",1. Cat 2. Chinchilla,8 Pets That May Keep You up at Night,Chinchillas,208,238
"3. leopard gecko leopard geckos are small, compact crepuscular reptiles. most leopard geckos will get up during the evening hours and be most active both during the evening and early mornings, although they will also spend some time awake overnight and occasionally during the day as well. leopard geckos will spend their awake time burrowing and hunting. most of their nighttime activity is quiet, so a leopard gecko enclosure can often be left in or near human sleeping areas. keep in mind their lighting requirements (heat is generally needed 24 hours per day) may bother some people at night. /24, ",3. Leopard Gecko,8 Pets That May Keep You up at Night,Chinchillas,100,111
"abscesses in chinchillas petmd.com /exotic/conditions/skin/c_ex_ch_abscess inflammatory skin lesions, abscesses when pus collects in a cavity under the skin or in the membrane of an organ, abscesses are formed. in chinchillas, abscesses usually occur following an infection from a bite wounds or other traumatic injuries. these infections may be bacterial, spreading to other areas of the body and causing abscesses to develop there, too. abscesses need to be treated promptly, as the infection may enter the blood stream, leading to toxemia and, in prolonged and severe cases, even death.","Abscesses in Chinchillas Inflammatory Skin Lesions, Abscesses",Abscesses in Chinchillas,Chinchillas,88,105
symptoms slight swelling beneath the fur a firm lump or growth pain while touching the growth redness in the area secretion of pus,Symptoms,Abscesses in Chinchillas,Chinchillas,23,23
causes infections due to bite wounds or traumatic injuries are the main causes for abscesses in chinchillas.,Causes,Abscesses in Chinchillas,Chinchillas,17,18
"diagnosis your veterinarian will conduct a physical examination of the skin lesions to rule out other skin-like cysts, hematomas and abdominal hernias by doing an exploratory puncture of the abscess and identifying the nature of its contents.",Diagnosis,Abscesses in Chinchillas,Chinchillas,37,40
"treatment ruptured abscesses should be completely drained and flushed with an antiseptic solution recommended by your veterinarian; appropriate topical antibiotic creams may be applied as needed. in the case of abscesses that have not yet ruptured, your veterinarian may advise removing the abscess surgically or applying topical heat producing ointments to it, so as to ripen the abscess and drain it. however, abscesses heal quicker when they are surgically removed. antibiotic medications are prescribed for both ruptured and nonruptured abscesses in order to prevent the infection from spreading elsewhere in the body. /24, ",Treatment,Abscesses in Chinchillas,Chinchillas,93,102
"living and management consult your veterinarian about the proper form to dress an abscess and its changing schedule. if your pet chinchilla has undergone surgery to remove the abscess, follow the postoperative procedures as recommended by your veterinarian. also, make sure your chinchilla does not groom the affected area, as it will interfere in the healing process.",Living and Management,Abscesses in Chinchillas,Chinchillas,57,63
"prevention promptly treating any injury or trauma to your chinchilla typically prevents abscesses from forming. /24, ",Prevention,Abscesses in Chinchillas,Chinchillas,16,18
"bacteria in the blood of chinchillas petmd.com /exotic/conditions/cardiovascular/c_ex_ch_septicemia septicemia in chinchillas septicemia is a suppurative disease causing bacteria and toxins in the blood of chinchillas. infections across multiple portions of your chinchilla's body may follow untreated bacterial gastroenteritis, although other bacteria may also cause it. because chinchillas may quickly succumb to the toxins and die suddenly, it is always best to consult a veterinarian when signs of general bacterial infection are noticed. propmt treatment is the best way to avoid the development of septicemia. the best way to treat septicemia is to first diagnose the specific organism that has caused the toxin to spread in the blood stream of the chinchilla. this is done through blood tests and culture and sensitivity tests. antibiotics are given orally or through injections. if the chinchilla is dehydrated, the antibiotics may be given along with the intravenous saline treatment.",Bacteria in the Blood of Chinchillas Septicemia in Chinchillas,Bacteria in the Blood of Chinchillas,Chinchillas,145,161
symptoms depression loss of appetite diarrhea weight loss rough coat death,Symptoms,Bacteria in the Blood of Chinchillas,Chinchillas,11,11
"causes the most common cause of septicemia is bacterial toxins in the blood. this can happen when bacterial infections, like bacterial gastroenteritis, are not treated. diagnosis observing the various non-specific signs exhibited by the chinchilla would make your veterinarian suspect a possible bacterial cause. the exact nature of the organisms, which are responsible for the condition, can be assessed only by performing blood tests.",Causes Diagnosis,Bacteria in the Blood of Chinchillas,Chinchillas,64,73
"treatment administering oral or injectable antibiotics are the best method for treating this condition. supportive care in the form of fluid and electrolyte therapy may also be needed to help overcome dehydration and other associated disorders. /24, ",Treatment,Bacteria in the Blood of Chinchillas,Chinchillas,37,40
