text,topic,blog_name,pet,word_count,chunk_size
"why do guinea pigs and chinchillas popcorn? typically, pet chinchillas and guinea pigs display this behavior when they are happy and excited. when guinea pigs and chinchillas are well-fed, have fresh water to drink, have room to exercise, receive attention from their owners and feel safe, they will typically popcorn in delight. rarely, however, these animals demonstrate this activity when they are scared. generally, owners can tell whether their popcorning pets are joyful or fearful by looking at their animals’ body language, listening to their vocalizations, and surveying the situation to see if anything could be eliciting fear. /24, have you ever seen your pet chinchilla or guinea pig popcorning? joyful animals look relaxed, rather than on high alert, as scared prey animals such as guinea pigs and chinchillas typically do when they’re afraid. also, fearful guinea pigs may let out high-pitched shrieks or growls, as opposed to short squeaks, purrs or “chuts” (a series of short, staccato noises) that happy guinea pigs make, while scared chinchillas may make barking or clicking sounds.",Why Do Guinea Pigs and Chinchillas Popcorn?,Have You Ever Seen Your Pet Chinchilla or Guinea Pig Popcorning_,Chinchillas,173,205
should pet parents worry if their pets perform this behavior,Should Pet Parents Worry If Their Pets Perform This Behavior,Have You Ever Seen Your Pet Chinchilla or Guinea Pig Popcorning_,Chinchillas,10,10
"or if they don’t at all? sometimes owners will see their pet chinchillas or guinea pigs popcorning for the first time and think these animals are having seizures. however, animals that seizure typically fall over to one side and twitch and flail uncontrollably, rather than pop up into the air. popcorning is a normal guinea pig and chinchilla behavior that these rodents have complete control of, and it is completely safe. on the other hand, some owners familiar with popcorning become concerned that their animals aren’t happy because they aren’t popcorning. not all guinea pigs and chinchillas popcorn when they are content, and not performing this behavior doesn’t mean that the animals aren’t happy. pet parents can encourage chinchilla and guinea pig popcorning by handling them gently and by providing them with lots of time out of their cages to run around; plenty of fresh hay and water; and smaller amounts of pellets, fresh veggies and occasional treats. many guinea pigs popcorn less or stop popcorning as they age. well-cared for guinea pigs and pet chinchillas may be perfectly content, yet they may not popcorn. so, don’t despair if you don’t see your precious pet perform this funny behavior, but certainly relax and enjoy watching him if he does! /24, have you ever seen your pet chinchilla or guinea pig popcorning? ",or If They Don’t at All?,Have You Ever Seen Your Pet Chinchilla or Guinea Pig Popcorning_,Chinchillas,221,252
"heat stress in chinchillas petmd.com /exotic/emergency/e_ex_ch_heat_stress heat stress is a condition that occurs when the body gets over heated due to an abnormality in the heat-regulating system of the body. high environmental temperature, high humidity, and inadequate ventilation are often the causes for the development of heat stress in chinchillas. chinchillas are very sensitive to sudden changes in their environment and when the temperature is above 80 degrees fahrenheit (27 degrees celsius) the chinchillas may experience various complications. if heat stress is not treated quickly, it can even prove fatal for the chinchilla.",Heat Stress in Chinchillas,Heat Stress in Chinchillas,Chinchillas,93,105
"symptoms restlessness (usually the first sign) deep and accelerated breathing drooling weakness fever respiratory complications (i.e., lung congestion) coma",Symptoms,Heat Stress in Chinchillas,Chinchillas,19,24
"causes excessive physical strain and obesity are often predisposing factors for the development in chinchillas. diagnosis other than observing the chinchilla's clinical symptoms, your veterinarian will make a diagnosis by recording the animal's rectal temperature and assessing its environmental conditions with the information you provide.",Causes Diagnosis,Heat Stress in Chinchillas,Chinchillas,45,50
"treatment in order to treat heat stress the chinchilla's body must be cooled off slowly by giving it cold water baths; cold water enemas may also be administered by your veterinarian. in order to properly cool the body, regularly check the chinchilla's rectal temperature and modify the treatment accordingly until its body temperature is normal. general supportive care such as vitamin and mineral supplements, intravenous (iv) fluids, and corticosteroids can all help stabilize the chinchilla and prevent it from going into a state of shock. /24, ",Treatment,Heat Stress in Chinchillas,Chinchillas,86,97
"living and management rest in a calm, cool and preferably dark environment are all essential for your chinchilla's recovery. also, provide adequate ventilation and regularly check its body temperature, bringing it back to the veterinarian at the first sign of a relapse.",Living and Management,Heat Stress in Chinchillas,Chinchillas,42,48
"prevention to help prevent heat stress, make sure that your chinchilla's cage is well ventilated and placed away from direct sunlight. /24, ",Prevention,Heat Stress in Chinchillas,Chinchillas,22,26
"herpes virus infection in chinchillas petmd.com /exotic/conditions/neurological/c_ex_ch_herpes_virus herpes virus 1 in chinchillas chinchillas may get the herpes virus infection through contact with humans suffering from herpes virus 1 infection. transmitted through the air or via infected water and food, the human herpes virus mainly affects the nervous system in chinchillas, though the eyes can also be affected. the signs exhibited by the affected chinchillas are mainly those involving the nervous system. other lesions are detected only during post-mortem examination of the dead chinchillas. chinchillas act as intermediary hosts of the herpes virus infection. hence, this disease in chinchillas needs to be addressed quickly.",Herpes Virus Infection in Chinchillas Herpes Virus 1 in Chinchillas,Herpes Virus Infection in Chinchillas,Chinchillas,103,117
symptoms disorientation seizures eye discharge nasal discharge death,Symptoms,Herpes Virus Infection in Chinchillas,Chinchillas,8,8
causes herpes virus 1 infection in chinchillas is caused by the human herpes virus. chinchillas may get the infection through contact with humans suffering from herpes virus 1 infection or via contaminated water and/or food. diagnosis the clinical signs exhibited by the chinchilla will lead your veterinarian to suspect a possible case of human herpes virus 1 infection in your pet chinchilla. confirmation is based on the lesions observed at necropsy and also the isolation of the virus from the central nervous system of the affected chinchillas.,Causes Diagnosis,Herpes Virus Infection in Chinchillas,Chinchillas,87,92
"treatment treatment specifically directed against this viral disease is not practical in chinchillas. however, symptomatic treatment to deal with the seizures, conjunctivitis, and rhinitis may be provided by your veterinarian as a short-term relief. /24, ",Treatment,Herpes Virus Infection in Chinchillas,Chinchillas,35,42
"living and management chinchillas affected with human herpes virus seldom recover from the condition. in fact, a veterinarian will recommend euthanizing (putting to sleep) an infected chinchilla, since it can serve as temporary reservoir for human infection. surviving chinchillas can be maintained separately and handled carefully. feed them a good diet, consisting of fresh foods. consult your veterinarian as to what foods are appropriate and any other management strategies that may be necessary.",Living and Management,Herpes Virus Infection in Chinchillas,Chinchillas,73,82
"prevention if you or any of your neighbors have been diagnosed as suffering from the human herpes virus, avoid handling your chinchilla. make sure that the foods and water given to your chinchilla is fresh and uncontaminated. these steps may help to reduce the incidences of human herpes virus infection in chinchillas. /24, ",Prevention,Herpes Virus Infection in Chinchillas,Chinchillas,53,58
"how long do chinchillas live? petmd.com /exotic/how-long-do-chinchillas-live it may come as a surprise to discover that although hamsters, guinea pigs, and many other small rodent pets live only a few years, chinchillas can live a long and full life. chinchillas are native to the harsh andes mountains of south america and are very rugged animals. domesticated chinchillas have been bred to be about twice the size of wild chinchillas, but have retained their quiet, shy personality. in the 1920s, eleven chinchillas were imported into the united states, and it is thought that almost every pet chinchilla in the us is directly related to one of these animals.",How Long Do Chinchillas Live?,How Long Do Chinchillas Live_,Chinchillas,107,125
"average chinchilla lifespan and aging in the wild, chinchillas live on average about six years, while our pets in captivity live much longer—often surviving 10–15 years. the oldest chinchilla on record was over 29 years old. the likely reason for this difference in longevity includes safety; our pet chinchillas are not eaten by predators as they age and slow down, and medical care is available to our pets as they age. most chinchillas will age in a similar fashion to cats and dogs. they start out life as kits and nurse on their mother for six to eight weeks. they mature into pediatric animals, then young adults by about 8 months—when they can breed—and finally to adulthood. with time and luck, they eventually become senior chinchilla citizens. different health needs are associated with each of these stages of life and maximizing the care available to your pet chinchilla at all stages helps to ensure they live long, healthy lives. the oldest chinchilla on record was over 29 years old.",Average Chinchilla Lifespan and Aging,How Long Do Chinchillas Live_,Chinchillas,169,189
"what makes some chinchillas live longer than others? in many cases, the care we provide our chins makes the biggest difference. chinchillas have very specific environmental and nutritional needs. pet parents can maximize their lifespan when we are able to meet these needs. other chinchillas develop injuries or illnesses. chinchillas, like most rodents, are very adept at hiding signs of medical problems; so close attention is needed to find and address an issue during the early stages. when in doubt, it is best to have a chinchilla-knowledgeable veterinarian check your furry friend out. not all veterinarians are experienced in chinchilla medicine, so be sure to find a veterinarian who takes exotic pets. /24, how long do chinchillas live? some chinchillas are just “poor doers,” meaning they just aren’t as healthy or well developed as others and are prone to developing problems such as dental disease, heart disease, or gastrointestinal problems. often, these little guys don’t survive as long as their sturdier relatives.",What Makes Some Chinchillas Live Longer Than Others?,How Long Do Chinchillas Live_,Chinchillas,162,188
how to improve your chinchilla’s lifespan there are many things that can be done to keep chinchillas healthy for as long as possible.,How To Improve Your Chinchilla’s Lifespan,How Long Do Chinchillas Live_,Chinchillas,23,25
"chinchilla nutrition perhaps the single most important factor is the chinchilla diet. chinchillas are herbivores, meaning they can only eat vegetable matter. in the wild, they exist on grasses, leaves, and other roughage in their environment. all too commonly, pet chins are fed pelleted diets and sweet “treats” marketed for chinchillas. these types of food commonly lead to health problems. chinchillas should be fed low calcium grass hays, such as: timothy hay orchard grass botanical hay oat hay meadow hay alfalfa hay should only be fed occasionally, if at all, as a treat. if timothy-based chinchilla pellets are fed, they should be limited to no more than a tablespoon per day. apple sticks can be offered as chew treats. if additional treats are offered, they should be limited to very small amounts of green vegetables or fresh fruits. never feed your chinchilla nuts, seeds, or dehydrated fruits. chinchilla teeth continue to grow throughout their lives and the high fiber roughage associated with the steady diet of hay and grass helps to keep these teeth properly worn.",Chinchilla Nutrition,How Long Do Chinchillas Live_,Chinchillas,176,202
"chinchilla exercise and enrichment make sure you keep your chinchilla safe and well exercised. chinchillas are remarkably active animals, and in the wild, they scramble to high vantage points to survey their territory. they also explore the world using their mouth. they will /24, how long do chinchillas live? continue to exhibit these behaviors in your house, as well. your chinchilla may try to climb up onto furniture or even onto your counters, so setting up a safe play area is important. chinchillas will also often chew items such as electrical cords as well as woodwork in the house—protecting both your belongings and your chinchilla is critical. large cages are necessary for chinchillas; this is a “safe zone” for when you can’t supervise your pet. chinchilla enclosures should have a sleeping area, a place to hide, an “exercise room” with a running wheel, and racks for hanging hay. chinchillas are social animals, so most people keep more than one. remember to increase the cage size if you choose to have multiple animals. in addition to a large cage, chinchillas need time out of the cage every day to exercise, explore, and stay mentally stimulated.",Chinchilla Exercise and Enrichment,How Long Do Chinchillas Live_,Chinchillas,194,223
"chinchilla healthcare lastly, plan ahead. chinchillas require regular health care and having a chinchilla- knowledgeable veterinarian is important. be sure to find a vet who specializes in exotic pets, even prior to adopting your chin. this will ensure you have medical help nearby. as soon as you get your new chinchilla, schedule a “new pet” visit to get established and to start on the right foot. this way, you will also be prepared if your furred friend develops a health problem and needs to be seen right away. chinchillas are friendly and intelligent animals which, with proper care, can live as long as the family cat! keep these steps in mind to make the most of the time with your chin friend. featured image: istock.com/jovanka_novakovic",Chinchilla Healthcare,How Long Do Chinchillas Live_,Chinchillas,125,144
"references riggs, shannon. mitchell, mark. chinchillas. manual of exotic pet practice. 2009. san diego zoo wildlife alliance – animals & plants. chinchilla. /24, how long do chinchillas live? ",References,How Long Do Chinchillas Live_,Chinchillas,28,39
"how to give your chinchilla a dust bath petmd.com /exotic/care/how-give-your-chinchilla-dust-bath by vanessa voltolina if you’ve ever told someone — or been told yourself — to stop playing in the dirt, then the concept of giving your new pet chinchilla the green light to roll around in dust may throw you for a loop. unlike other types of small and furries, chinchillas are self-motivated to get squeaky clean with the assistance of dust as opposed to water. while the practice may seem odd, it’s important to give your furry friend the type of grooming care it deserves to keep its skin healthy and its coat in beautiful condition. here, learn more about dust baths, why your chin requires them, and how to provide it.",How to Give Your Chinchilla a Dust Bath,How to Give Your Chinchilla a Dust Bath,Chinchillas,123,144
"why a dust bath? according to pet care veterinary hospital in virginia beach, va, dust baths are necessary for chinchillas to counterbalance their naturally oily skin and to maintain their soft fur. in their native home in south america, chinchillas might roll in volcanic ash to stay clean — hence, why they require a special process in areas not teeming with this ash. chinchillas also possess up to 60 hairs per follicle (note that humans have one hair per follicle), which allows them to retain body heat at high altitudes. this specialized fur means it’s prone to clumping, and skin may become irritated if a chin doesn’t receive an adequate number of dust baths. if you’re a first-time chin owner, one of the first things you may notice is the cleanliness and low-odor associated with these pets. giving your chinchilla the occasional dust bath will help keep it clean and pull the oil, dirt and excess moisture from its coat, said laurie hess, dvm, owner and medical director of veterinary center for birds & exotics in bedford hills, ny.",Why a Dust Bath?,How to Give Your Chinchilla a Dust Bath,Chinchillas,179,204
"getting started to begin the dust bath process, you’ll need a plastic dishpan or container (approximately 12” long by 6” deep and wide, or with enough room so that your chin doesn’t get dust all over the place!). you can also purchase a dedicated chinchilla bath house (a plastic container with a spherical bottom and a roof-shaped top) online or at your local animal supply store; these can be good options for containing both the dust and your pet and can often be hooked to the inside of your chinchilla’s cage. the main component of the bath, chinchilla dust, can also be found online and in pet stores. note that sand is not the same thing as chinchilla dust; using sand may cause serious irritations to both your pet’s skin and eyes, as well as damage its fur, /24, according to hess. generally, dust baths should be offered to your chin about two to three times per week, as excessive access may contribute to drying out its skin. here’s how to give your chinchilla a dust bath: 1. to begin, fill your container or bath house about 2-inches deep with dust. 2. once you’ve set up the “bath,” place your chinchilla in the container. the good news is that this is where your job ends, and your chin takes over. “they usually know what to do, and they just roll,” said hess, who specializes in birds and exotic pet care. let your pet enjoy the bath to keep its coat fresh and clean. you’ll want to change the dust in your chinchilla dust bath at least once a week, hess said, adding that the dust can get all over the place after a few baths. when you see the dust clumping or looking not-so-fresh, this is the indication that it’s time for a change. image: cynoclub via shutterstock /24, ",Getting Started,How to Give Your Chinchilla a Dust Bath,Chinchillas,309,365
infection and inflammation of the uterus in chinchillas petmd.com /exotic/conditions/reproductive/c_ex_ch_metritis,Infection and Inflammation of the Uterus in Chinchillas,Infection and Inflammation of the Uterus in Chinchillas,Chinchillas,10,14
"metritis in chinchillas metritis, otherwise known as the infection and inflammation of the uterus, typically affects female chinchillas that have recently given birth. it commonly occurs when the placenta and fetal membranes remain in the uterus leading to bacterial infection. metritis is a serious condition in female chinchillas because the kits may get the infection from the mother and the mother itself may die if untreated from severe bacterial infection. symptoms inability to walk loss of appetite weight loss lack of milk production fever swollen genitals vaginal discharge",Metritis in Chinchillas Symptoms,Infection and Inflammation of the Uterus in Chinchillas,Chinchillas,88,93
causes a retained placenta or fetus that is not delivered may undergo decomposition in the uterus and lead to metritis.,Causes,Infection and Inflammation of the Uterus in Chinchillas,Chinchillas,20,21
diagnosis a diagnosis can be made by the clinical signs observed. the vaginal discharge may be collected and swabs can be stained and viewed under a microscope to identify the causative bacteria. alternatively the vaginal secretions may be collected and grown in suitable culture medium for the identification of the causative bacteria so that suitable antibiotics can be administered to treat the condition effectively.,Diagnosis,Infection and Inflammation of the Uterus in Chinchillas,Chinchillas,64,67
"treatment early detection and treatment are essential because affected female chinchillas can develop a severe and fatal bacterial infection with sudden deterioration and death. a veterinarian can give medicine that causes uterine contractions and forces out the infected debris. the veterinarian will then clean and disinfect the reproductive tract and the uterus. antibiotics and general support should also be provided. /24, ",Treatment,Infection and Inflammation of the Uterus in Chinchillas,Chinchillas,61,66
"living and management the chinchilla undergoing treatment for metritis should be given proper care, including rest in a quiet and calm environment and a well-balanced diet. your veterinarian will advise you as to the antibiotic therapy needed. in addition, he or she will recommend that you nurse the nurse the kits with another female or hand feed them until the mother chinchilla recovers so that the infection does not spread to the kits through the milk of the mother.",Living and Management,Infection and Inflammation of the Uterus in Chinchillas,Chinchillas,79,85
"prevention after giving birth, chinchillas should be monitored for the expulsion of the placenta. if it is not shed within the recommended time, contact a veterinarian. treating the condition early can help prevent cases of metritis in female chinchillas. /24, ",Prevention,Infection and Inflammation of the Uterus in Chinchillas,Chinchillas,40,46
"infertility in chinchillas petmd.com /exotic/conditions/reproductive/c_ex_ch_infertility inability to give birth in chinchillas there are many factors responsible for infertility in chinchillas. these factors can include improper nutrition, genetic predisposition, and even infections. infertility is a problem in both male and female chinchillas. it is difficult to treat infertility once it has been diagnosed, therefore prevention is key. when a chinchilla is infertile, it has no interest in mating. when infertility is due to overfeeding or underfeeding, the chinchilla will be either overweight or malnourished and weak. infection of reproductive organs produces a pus-filled discharge and foul smell.",Infertility in Chinchillas Inability to Give Birth in Chinchillas,Infertility in Chinchillas,Chinchillas,96,113
symptoms lack of interest in mating lethargy ragged coat obesity fever vaginal discharge,Symptoms,Infertility in Chinchillas,Chinchillas,13,13
"causes poor reproduction may be due to any of several possible causes: malnu­ trition, abnormal sperm, hormonal imbalance, infectious disease, lack of experience, and lethal genes from inappropriate crosses. for instance, mating between or among chinchillas with matched genes for white and velvet coat color should be avoided. infectious and dietary factors as well as poor conditioning may also cause infertility in both male and female chinchillas. diagnosis diagnosis is made by the case history provided by the owner and also the symptoms observed. when infertility is suspected to be the underlying cause, blood tests may be necessary to ascertain the exact cause and develop an appropriate course of treatment.",Causes Diagnosis,Infertility in Chinchillas,Chinchillas,110,124
"treatment if infertility is due to nutritional reasons, your veterinarian may suggest the administration of vitamin and mineral supplements. if infertility is due to overfeeding, a special diet for the chinchilla should be administered to reduce body weight. in /24, case infertility is due to infections, then it is essential to treat the chinchilla with specific antibiotics.",Treatment,Infertility in Chinchillas,Chinchillas,57,64
"living and management regarding the chinchilla's diet and at-home follow-up therapy, follow your veterinarian's advice. it is important you do not rush the chinchilla to mate again, but rather slowly introduce it to its partner gradually.",Living and Management,Infertility in Chinchillas,Chinchillas,36,44
"prevention feeding a well-balanced nutritious diet specially formulated for chinchillas can prevent infertility. do not allow your chinchilla to get overweight; regularly allow it some playtime so as to get some exercise. following the correct crossing procedures recommended for chinchillas can help prevent the development of infertility due to genetic reasons. /24, ",Prevention,Infertility in Chinchillas,Chinchillas,52,58
